<?xml version="1.0" encoding="UTF-8" ?>
<!ELEMENT classe (stu*,xiaoxiaoran*)>
<!ELEMENT xiaoxiaoran (#PCDATA)>
<!ELEMENT stu (name,sex+,url*)>
<!ELEMENT name (#PCDATA)>
<!ELEMENT sex (#PCDATA)>
<!ELEMENT url ANY>
<!ELEMENT a (#PCDATA)>
<!ATTLIST a href CDATA "127.0.0.1">
